{
  "scene_id": "pilot-scene-01",
  "reference_images": [
    "/workspace/mai-fitness/refs/REPLACE_WITH_FRONT_FACE_IMAGE.png",
    "/workspace/mai-fitness/refs/REPLACE_WITH_THREE_QUARTER_FACE_IMAGE.png",
    "/workspace/mai-fitness/refs/REPLACE_WITH_OPTIONAL_BODY_OR_OUTFIT_IMAGE.png"
  ],
  "face_reference_ids": [
    "/workspace/mai-fitness/refs/REPLACE_WITH_FRONT_FACE_IMAGE.png",
    "/workspace/mai-fitness/refs/REPLACE_WITH_THREE_QUARTER_FACE_IMAGE.png"
  ],
  "face_description_mode": "reference_only",
  "character_description": "Optional ASCII English description of stable non-facial identity details, such as hair color and skin tone.",
  "model": "Omni 1.1 Flash",
  "resolution": "360p",
  "duration": "8s",
  "prompt": "An adult woman performs one controlled yoga flow in a quiet studio. Full body visible, stable camera, natural motion, realistic anatomy, soft daylight. One continuous shot, no cuts, no text, no logos. Keep the chest fully covered with a high, closed neckline and no cleavage."
}
